<?xml version="1.0"?>
<?xml-stylesheet type="text/xsl" href="amqp.xsl"?>

<!--
  Licensed to the Apache Software Foundation (ASF) under one or more
  contributor license agreements.  See the NOTICE file distributed with
  this work for additional information regarding copyright ownership.
  The ASF licenses this file to You under the Apache License, Version 2.0
  (the "License"); you may not use this file except in compliance with
  the License.  You may obtain a copy of the License at

  http://www.apache.org/licenses/LICENSE-2.0

  Unless required by applicable law or agreed to in writing, software
  distributed under the License is distributed on an "AS IS" BASIS,
  WITHOUT WARRANTIES OR CONDITIONS OF ANY KIND, either express or implied.
  See the License for the specific language governing permissions and
  limitations under the License.
  -->

<!DOCTYPE amqp SYSTEM "amqp.dtd">

<amqp name="transactions" label="the AMQP Transactions Layer">

  <!-- == Section: transactions ================================================================ -->

  <section name="transactions" title="Transactional Messaging">
    <doc>
      <p>
        Transactional messaging allows for the coordinated outcome of otherwise independent
        transfers. This extends to an arbitrary number of transfers spread across any number of
        distinct links in either direction.
      </p>

      <p>
        For every transactional interaction, one container acts as the <i>transactional
        resource</i>, and the other container acts as the <i>transaction controller</i>.
        The <i>transactional resource</i> performs <i>transactional work</i> as requested by
        the <i>transaction controller</i>.
      </p>

      <p>
        The <i>transactional controller</i> and <i>transactional resource</i> communicate over a
        <i>control link</i> which is established by the <i>transactional controller</i>.  The <xref
        name="declare"/> and <xref name="discharge"/> messages are sent by the <i>transactional
        controller</i> over the <i>control link</i> to allocate and complete transactions
        respectively (they do not represent the demarcation of transactional work). No transactional
        work is allowed on the <i>control link</i>. Each transactional operation requested is
        explicitly identified with the desired transaction-id and therefore may occur on any link
        within the controlling Session, or, if permitted by the capabilities of the controller, any
        link on the controlling Connection. If the <i>control link</i> is closed while there exist
        non-discharged transactions it created, then all such transactions are immediately rolled
        back, and attempts to perform further transactional work on them will lead to failure.
      </p>
    </doc>
  </section>

  <section name="txn-declare" title="Declaring a Transaction">
    <doc>
      <p>
        The container acting as the transactional resource defines a special target that functions
        as a <xref name="coordinator">transaction coordinator</xref>. The <i>transaction
        controller</i> establishes a control link to this target. Note that links to the <xref
        name="coordinator"/> cannot be resumed.
      </p>
      <p>
        To begin transactional work, the transaction controller must obtain a transaction identifier
        from the resource. It does this by sending a message to the <xref name="coordinator"/> whose
        body consists of the <xref name="declare"/> type in a single <xref type="type"
        name="amqp-value"/> section. Other standard message sections such as the header section
        SHOULD be ignored. This message MUST NOT be sent settled as the sender is required to
        receive and interpret the outcome of the declare at the receiver. If the coordinator
        receives a <xref type="type" name="transfer"/> that has been settled by the sender, it
        should <xref type="type" name="detach"/> with an appropriate error.
      </p>
      <p>
        If the declaration is successful, the coordinator responds with a disposition outcome of
        <xref name="declared"/> which carries the assigned identifier for the transaction.
      </p>
      <p>
        If the coordinator was unable to perform the <xref name="declare"/> as specified by
        the transaction controller, the transaction coordinator MUST convey the error to the
        controller as a <xref name="transaction-error"/>. If the <xref name="source"/> for the link
        to the <xref name="coordinator"/> supports the <xref name="rejected"/> outcome, then the
        message MUST be <xref name="rejected"/> with this outcome carrying the <xref
        name="transaction-error"/>.  If the <xref name="source"/> does not support the <xref
        name="rejected"/> outcome, the <i>transactional resource</i> MUST <xref name="detach"/> the
        link to the coordinator, with the <xref name="detach"/> performative carrying the <xref
        name="transaction-error"/>.
      </p>
      <p>
        Transaction controllers SHOULD establish a control link that allows the
        <xref name="rejected"/> outcome.
      </p>
      <picture title="Declaring a Transaction"><![CDATA[
Transaction Controller                  Transactional Resource
===============================================================================

ATTACH(name=txn-ctl,          --------->
       ...,
       target=
         Coordinator(
           capabilities=
             "amqp:local-transactions")
      )

                             <--------- ATTACH(name=txn-ctl,
                                               ...,
                                               target=
                                                 Coordinator(
                                                   capabilities=
                                                     ["amqp:local-transactions",
                                                      "amqp:multi-txns-per-ssn"]
                                                            )
                                              )

                             <--------- FLOW(...,handle=1, link-credit=1)

TRANSFER(delivery-id=0, ...) --------->
{ AmqpValue( Declare() ) }

                             <--------- DISPOSITION(first=0, last=0,
                                                    state=Declared(txn-id=0) )

-------------------------------------------------------------------------------
]]>
      </picture>
    </doc>
  </section>

  <section name="txn-discharge" title="Discharging a Transaction">
    <doc>
      <p>
        The controller will conclude the transactional work by sending a <xref name="discharge"/>
        message (encoded in a single <xref type="type" name="amqp-value"/> section) to the
        coordinator. The controller indicates that it wishes to commit or rollback the transactional
        work by setting the <i>fail</i> flag on the <xref name="discharge"/> body. As with the <xref
        type="type" name="declare"/> message, it is an error if the sender sends the <xref
        type="type" name="transfer"/> pre-settled.
      </p>
      <p>
        Should the coordinator be unable to complete the <xref name="discharge"/>, the coordinator
        MUST convey the error to the controller as a <xref name="transaction-error"/>. If the <xref
        type="type" name="source"/> for the link to the <xref name="coordinator"/> supports the
        <xref type="type" name="rejected"/> outcome, then the message MUST be <xref type="type"
        name="rejected"/> with this outcome carrying the <xref name="transaction-error"/>.  If the
        <xref type="type" name="source"/> does not support the <xref type="type" name="rejected"/>
        outcome, the <i>transactional resource</i> MUST <xref type="type" name="detach"/> the link
        to the coordinator, with the <xref type="type" name="detach"/> performative carrying the
        <xref name="transaction-error"/>.  Note that the coordinator MUST always be able to complete
        a <xref name="discharge"/> where the fail flag is set to true (since coordinator failure
        leads to rollback, which is what the controller is asking for).
      </p>

      <picture title="Discharging a Transaction"><![CDATA[
Transaction Controller                  Transactional Resource
===============================================================================

TRANSFER(delivery-id=0, ...) --------->
{ AmqpValue( Declare() ) }

                             <--------- DISPOSITION(first=0, last=0,
                                                    state=Declared(txn-id=0) )

                                  :
                          Transactional Work
                                  :


TRANSFER(delivery-id=57, ...) --------->
{ AmqpValue(
    Discharge(txn-id=0,
              fail=false)
           ) }

                             <--------- DISPOSITION(first=57, last=57,
                                                    state=Accepted() )

-------------------------------------------------------------------------------
]]>
      </picture>
    </doc>
  </section>

  <section name="txn-work" title="Transactional Work">
    <doc>
      <p>
        Transactional work is described in terms of the message states defined in <xref type="doc"
        name="message-state"/>. Transactional work is formally defined to be composed of the
        following operations:
      </p>

      <ul>
        <li>
          <p><i>posting</i> a message at a target, i.e. making it <i>available</i></p>
        </li>
        <li>
          <p><i>acquiring</i> a message at a source, i.e. transitioning it to <i>acquired</i></p>
        </li>
        <li>
          <p><i>retiring</i> a message at a source, i.e. applying the terminal outcome</p>
        </li>
      </ul>

      <p>
        The transactional resource performs these operations when triggered by the transaction
        controller: